{
  "schema_version": "2026-05-18-r02",
  "scheme_id": "negative_d_axis_field_weakening",
  "scheme_short": "S01",
  "binding_purpose": "r02 production-parameter binding for S01 negative d-axis field weakening. Reuses sim.run_control_lut_generator.run with demag-focused kwargs.",
  "engineering_validated": false,
  "simulation_status": "numeric_proxy_passed",
  "model_maturity": "parameterized_linear_model",
  "gate_class": "proxy",
  "entry": "sim.run_control_lut_generator",
  "function": "run",
  "kwargs": {
    "model_type": "linear_dq",
    "torque_axis_nm": [
      80.0,
      100.0,
      120.0
    ],
    "torque_step_nm": 20.0,
    "temperature_c": 100.0,
    "demag_limit": {
      "$ref": "models/demag_limit_estimate.json"
    }
  },
  "expect": {
    "metadata.generator_version.regex": "^\\d{4}-\\d{2}-\\d{2}-\\w+$",
    "model_source.model_type.enum": [
      "linear_dq",
      "nonlinear_flux_lut"
    ],
    "grid_definition.speed_axis_rpm.count_min": 60,
    "grid_definition.torque_axis_nm.count_min": 3,
    "feasibility_map.feasible_points.min": 60,
    "feasibility_map.infeasible_reasons.search_not_converged.max": 100,
    "feasibility_map.infeasible_reasons.demagnetization_risk.max": 200,
    "p0_acceptance.voltage_exceeded_ratio.max": 0.95,
    "validation.torque_discontinuity_at_transitions_nm.max": 5.0,
    "p0_acceptance.max_id_jump_a.max": 60.0,
    "p0_acceptance.max_iq_jump_a.max": 60.0,
    "metadata.demag_limit.present": true
  },
  "soft_checks": [
    "feasibility_map.infeasible_reasons.search_not_converged.max",
    "feasibility_map.infeasible_reasons.demagnetization_risk.max",
    "p0_acceptance.voltage_exceeded_ratio.max",
    "p0_acceptance.max_id_jump_a.max",
    "p0_acceptance.max_iq_jump_a.max"
  ],
  "strong_checks": [
    "metadata.generator_version.regex",
    "model_source.model_type.enum",
    "grid_definition.speed_axis_rpm.count_min",
    "grid_definition.torque_axis_nm.count_min",
    "feasibility_map.feasible_points.min",
    "validation.torque_discontinuity_at_transitions_nm.max",
    "metadata.demag_limit.present"
  ],
  "dvp_mapping": {
    "S01-DV-001": "mode_transitions + validation.torque_discontinuity_at_transitions_nm",
    "S01-DV-002": "metadata.demag_limit + feasibility_map.infeasible_reasons.demagnetization_risk",
    "S01-DV-003": "Vdc sense accuracy (HIL-side, not numeric)",
    "S01-DV-004": "Phase current sense fault injection (HIL-side, not numeric)",
    "S01-DV-005": "Gate-disable latch (bench, not numeric)"
  },
  "open_items": [
    "Replace Rs/Ld/Lq/psi_f estimates with nonlinear-flux LUT or FEA.",
    "Replace DemagLimit piecewise estimate with S11 thermal + magnet vendor curve.",
    "Realize hardware gate-disable < 100 μs assertion measurement in r03 bench."
  ],
  "related_artifacts": {
    "concept_images": [
      "gpt-image-2/outputs/S01/V2-S01-ILL-T01-driver_block-r00.png",
      "gpt-image-2/outputs/S01/V2-S01-ILL-T03-state_machine-r00.png"
    ],
    "r01_prompts": "codex-review/docs/scheme_drawing_prompts_r01_batch/scheme-01-r01.md",
    "drawio_source": "engineering/v2/scheme-01/controller/V2-S01-CTRL-field_weakening_state_machine-r00.drawio",
    "acceptance_sheet": "engineering/v2/scheme-01/parameters/V2-S01-PARAM-acceptance-r02.md",
    "dvpr_draft": "engineering/v2/scheme-01/test_dvpr/V2-S01-DVP-fw_fault_injection-r00.md",
    "motor_params": "models/motor_params.json",
    "pytest_entry": "tests/test_scheme_p0_lut_acceptance.py"
  }
}
