{
  "schema_version": "2026-05-18-r02",
  "scheme_id": "winding_reconfiguration",
  "scheme_short": "S09",
  "binding_purpose": "r02 binding for S09 winding reconfiguration (research pool). Drives sim.run_winding_reconfiguration_experiment.run.",
  "engineering_validated": false,
  "simulation_status": "binding_smoke_passed",
  "model_maturity": "research_pool_proxy",
  "gate_class": "smoke",
  "entry": "sim.run_winding_reconfiguration_experiment",
  "function": "run",
  "kwargs": {},
  "expect": {
    "experiment.equals": "exp_008_winding_reconfiguration",
    "engineering_validated.equals": false,
    "configs.count_min": 2,
    "transitions.count_min": 1,
    "row_count.min": 1,
    "recommended_config.present": true,
    "csv_path.present": true
  },
  "soft_checks": [],
  "strong_checks": [
    "experiment.equals",
    "engineering_validated.equals",
    "configs.count_min",
    "transitions.count_min",
    "row_count.min",
    "recommended_config.present",
    "csv_path.present"
  ],
  "dvp_mapping": {
    "S09-DV-001": "switching transient (zero-torque window 50-200 ms)",
    "S09-DV-002": "circulating current < 5 A",
    "S09-DV-003": "arc / insulation at 800 V",
    "S09-DV-004": "illegal-state fallback < 1 ms",
    "S09-DV-005": "parallel-path thermal sharing and contactor derating"
  },
  "open_items": [
    "Replace Ke/Kt static scaling with contactor switching transient model.",
    "Add circulating current and parallel-path thermal sharing.",
    "Research pool: do NOT interpret as production candidate."
  ],
  "related_artifacts": {
    "r01_prompts": "codex-review/docs/scheme_drawing_prompts_r01_batch/scheme-09-r01.md",
    "pytest_entry": "tests/test_scheme_experiment_acceptance.py"
  }
}
